{"$schema":"https://json-schema.org/draft/2020-12/schema","$defs":{"point":{"type":"object","properties":{"x":{"type":"number"},"y":{"type":"number"}},"required":["x","y"],"additionalProperties":false},"shape":{"oneOf":[{"type":"object","properties":{"kind":{"const":"circle"},"center":{"$ref":"#/$defs/point"},"radius":{"type":"number","exclusiveMinimum":0}},"required":["kind","center","radius"],"additionalProperties":false},{"type":"object","properties":{"kind":{"const":"polygon"},"points":{"type":"array","minItems":3,"items":{"$ref":"#/$defs/point"}}},"required":["kind","points"],"additionalProperties":false},{"type":"object","properties":{"kind":{"const":"label"},"at":{"$ref":"#/$defs/point"},"text":{"type":"string","minLength":1}},"required":["kind","at","text"],"additionalProperties":false}]},"node":{"type":"object","properties":{"id":{"type":"string","pattern":"^[a-z][a-z0-9_]{2,15}$"},"tags":{"type":"array","items":{"enum":["red","green","blue","alpha","beta","gamma"]}},"shapes":{"type":"array","items":{"$ref":"#/$defs/shape"}},"children":{"type":"array","items":{"$ref":"#/$defs/node"}}},"required":["id","shapes"],"additionalProperties":false}},"type":"object","properties":{"version":{"type":"integer","minimum":1,"maximum":9},"title":{"type":"string","maxLength":120},"root":{"$ref":"#/$defs/node"},"metadata":{"type":"object","additionalProperties":{"anyOf":[{"type":"string"},{"type":"number"},{"type":"boolean"}]}}},"required":["version","root"],"additionalProperties":false}
