{"version":2,"title":"Scene graph with nested shapes","root":{"id":"scene_root","tags":["red","blue"],"shapes":[{"kind":"circle","center":{"x":1.5,"y":-2},"radius":3.25},{"kind":"polygon","points":[{"x":0,"y":0},{"x":4,"y":0},{"x":2,"y":3.5}]},{"kind":"label","at":{"x":10,"y":10},"text":"origin marker"}],"children":[{"id":"child_one","tags":["alpha"],"shapes":[{"kind":"label","at":{"x":0.5,"y":0.5},"text":"leaf"}],"children":[{"id":"grandchild","shapes":[{"kind":"circle","center":{"x":0,"y":0},"radius":1}]}]},{"id":"child_two","shapes":[]}]},"metadata":{"author":"spike","revision":7,"draft":false}}
